{
  "card_key": "FCT-41",
  "tenant_id": "freundcloud",
  "title": "Publish the agent-skills manifest from TFactory",
  "acceptance_criteria": [
    "GET /.well-known/agent-skills/index.json validates as kind: service",
    "The route is registered before the SPA catch-all and returns application/json"
  ],
  "status": "in_progress",
  "priority": 10,
  "tier": "low",
  "assignee": "aifactory",
  "milestone": "RFC-0019 phase 4",
  "correlation_key": "302",
  "created_at": "2026-07-24T14:30:00Z",
  "updated_at": "2026-07-25T08:41:00Z"
}
